"Review #","Brand","Variety","Style","Country","Stars","Top Ten"
"1599","Nissin","Top Ramen Super Noodles Tomato","Pack","India","3.5",""
"1598","Mama","Cup Rice Vermicelli Shrimp Creamy Tom Yum","Cup","Thailand","4",""
"1597","Nissin","Original Chow Mein Premium Spicy Chicken Flavor","Tray","USA","4",""
"1596","Uncle Sun","White Curry Noodle More Spicy","Pack","Malaysia","3",""
"1595","JML","Emporer Instant Noodles Spicy Chicken","Pack","China","5",""
"1594","Acecook","Jan Jan Dashi Shoyu Yakisoba","Cup","Japan","2.25",""
"1593","Nongshim","Tteokgukmyun","Pack","South Korea","4.25",""
"1592","Mom's Dry Noodle","Vegan Chilli With Sesame Sauce","Pack","Taiwan","5",""
"1591","Mi E-Zee","Perisa Sayuran","Pack","Malaysia","3.5",""
"1590","Mi E-Zee","Perisa Kari Sayuran","Pack","Malaysia","3.75",""
"1589","E-mi","Mi Perencah Ayam Jagung","Pack","Malaysia","3.75",""
"1588","Mi E-Zee","Perisa Bayam","Pack","Malaysia","3.5",""
"1587","Mi E-Zee","Plain Noodles","Pack","Malaysia","Unrated",""
"1586","J.J.","Snek Mi Perisa Ayam","Pack","Malaysia","3.75",""
"1585","CarJEN","Nyonya Curry Laksa","Pack","Malaysia","5","2015"
"1584","E-mi","Mi Perencah Asam Pedas","Pack","Malaysia","3.75",""
"1583","J.J.","Snek Mi Perisa BBQ","Pack","Malaysia","4",""
"1582","Mi E-Zee","Perisa Kari / Curry Flavour","Pack","Malaysia","4",""
"1581","United","3 Con Tom Instant Noodles Thailand Sour Shrimp Flavor","Pack","Vietnam","2.75",""
"1580","Emart","Dare You! Habanero Ramen","Pack","South Korea","3.75",""
