"Week","Power of No","Total vetoed","Previous HoH","Vetoed housemates","Saved housemates"
"2","Fernanda","4","Fani","Kamilla, Marcello, Natália, Yuri","(none)"
"3","Marcello","3","Ivan","Anamara, Andressa, Fernanda","(none)"
"4","Marien","5","Anamara","André M., Fani, Fernanda, Kamilla, Yuri","Fani"
"5","Fernanda","6","Marien","Anamara, Eliéser, Fani, Ivan, Nasser, Natália","Fani, Ivan, Nasser"
"6","Eliéser","4","Kamilla","Fani, Ivan, Marcello, Nasser","Ivan, Marcello"
"7","Nasser","5","Anamara","André M., Eliéser, Fani, Fernanda, Kamilla","André M., Fani"
"8","Fani","4","André M.","Andressa, Fernanda, Marcello, Nasser","Andressa, Nasser"
"9","André M.","3","Kamilla","Andressa, Nasser, Natália","Nasser, Natália"
"10","André M.","1","Fernanda","Nasser","(none)"
