"Round","#","Player","Nationality","NHL team","College/junior/club team (League)"
"2","56","Blake Geoffrion","United States","Nashville Predators","US National Team Development Program"
"4","105","Niko Snellman","Finland","Nashville Predators (from Atlanta)","Ilves"
"5","146","Mark Dekanich","Canada","Nashville Predators","Colgate University"
"6","176","Ryan Flynn","United States","Nashville Predators","US National Team Development Program"
"7","206","Viktor Sjödin","Sweden","Nashville Predators","Västerås Jr."
