"Order of Performance","Singer","Song Title","Original Singer","Comedian Manager","Ranking"
"1","Juckwoo","이등병의 편지 (Letter of a Private)","Kim Kwang-suk","Kim Sook","6"
"2","Yoon Min-soo","잊지 말아요(Do Not Forget)","Baek Ji-young","Song Eun-ee","3"
"3","Tei","내 생애 봄날은 (Spring in my life)","Can","Kim Tae-hyun","7"
"4","Shin Hyo-bum","미련한 사랑 (Foolish Love)","JK Kim Dong-wook","Park Hwi-soon","5"
"5","Kim Kyung-ho","걸어서 하늘까지 (Walking all the way to Sky)","Jang Hyun-cheol","Jung Sung-ho","2"
"6","Gummy","애인있어요 (I have a lover)","Lee Eun-mi","Kim Shin-young","4"
"7","Park Wankyu","하망연(何茫然)","Alessandro Safina","Ji Sang-ryul","1"
