"Year","Pos","Class","No","Drivers","Chassis","Engine","Lap","Speed (km/h)"
"1925","14","1.5","39","Jean d'Aulan René Dély","DT Spéciale","CIME 1,496cc I4","103","74.435"
"1925","34","1.5","38","Marcel Benoist Michel Doré","DT Spéciale","CIME 1,496cc I4","41","DNF"
"1926","8","1.5","37","Henri de Costier Pierre Bussienne","DS Grand Sport","CIME 1,202cc I4","111","80.103"
"1926","27","1.5","38","""Morac"" Marcel Ballot","DS Grand Sport","CIME 1,202cc I4","62","DNF"
"1926","34","1.5","28","Guy Bouriat Guy Dollfuss","DT Tank","CIME 1,496cc I4","34","DNF"
"1927","5","1.1","26","Guy Bouriat Pierre Bussienne","DS Spécial","CIME 1,094cc I4","108","78.105"
"1927","22","1.1","27","Henri De Costier Georges Guignard","DS Spécial","CIME 1,094cc I4","8","DNF"
"1928","14","1.1","36","Guy Bouriat Pierre Bussienne","Spécial","CIME 1,094cc I6","115","83.23"
