"Round","Circuit","Date","Winning driver","Winning team"
"2","Zolder","2000-05-05T00:00:00","Emanuele Pirro Emanuele Pirro","A.Z.K./ROC-Competition A.Z.K./ROC-Competition"
"12","Assen","2000-05-19T00:00:00","Steve Soper Laurent Aiello","BMW Team Bigazzi Peugeot Esso"
"30","Hockenheimring","2000-06-02T00:00:00","Emanuele Pirro Emanuele Pirro","A.Z.K./ROC-Competition A.Z.K./ROC-Competition"
"56","Sachsenring","2000-06-30T00:00:00","Philipp Peter Emanuele Pirro","A.Z.K./ROC-Competition A.Z.K./ROC-Competition"
"90","Wunstorf","2000-07-11T00:00:00","Steve Soper Emanuele Pirro","BMW Team Bigazzi A.Z.K./ROC-Competition"
"132","Zweibrücken","2000-08-11T00:00:00","Laurent Aiello Laurent Aiello","Peugeot Esso Peugeot Esso"
"182","Salzburgring","2000-08-25T00:00:00","Steve Soper Armin Hahne","BMW Team Bigazzi Honda Team Linder"
"240","AVUS","2000-09-08T00:00:00","Armin Hahne Emanuele Pirro","Honda Team Linder A.Z.K./ROC-Competition"
"306","Nürburgring","2000-09-22T00:00:00","Emanuele Pirro Emanuele Pirro","A.Z.K./ROC-Competition A.Z.K./ROC-Competition"
