"Number notation","Power notation","Short scale","Long scale","Indian (or South Asian) English"
"1,000,000","2000-10-06T00:00:00","one million","one million","ten lakh"
"1,000,000,000","2000-10-09T00:00:00","one billion a thousand million","one milliard a thousand million","one hundred crore"
"1,000,000,000,000","2000-10-12T00:00:00","one trillion a thousand billion","one billion a million million","one lakh crore"
"1,000,000,000,000,000","2000-10-15T00:00:00","one quadrillion a thousand trillion","one billiard a thousand billion","ten crore crore"
"1,000,000,000,000,000,000","2000-10-18T00:00:00","one quintillion a thousand quadrillion","one trillion a million billion","ten thousand crore crore"
"1,000,000,000,000,000,000,000","2000-10-21T00:00:00","one sextillion a thousand quintillion","one trilliard a thousand trillion","one crore crore crore"
