"High School","Type","Established","Enrollment","Mascot","WIAA Classification","Notes"
"Henry Foss","comprehensive","1973-01-01T00:00:00","1298","Falcons","2000-01-01T03:00:00","Located in Central Tacoma"
"Lincoln","comprehensive","1913-01-01T00:00:00","1618","Abes","2000-01-01T03:00:00","Located in East Tacoma"
"Mount Tahoma","comprehensive","1961-01-01T00:00:00","1865","Thunderbirds","2000-01-01T03:00:00","Located in South Tacoma"
"Oakland Alternative","alternative","1988-01-01T00:00:00","106","Eagles","","Located in Central Tacoma"
"Tacoma School of the Arts","magnet","2001-01-01T00:00:00","500","","","Located in downtown Tacoma"
