"School District","Headquarters","Sector","Enrollment (2011-12)","Teachers (2008-09","Student-Teacher ratio (2008-09)","French enrollment (2011-12)","Graduation rate (2011-12)","Withdrawal rate (2010-11)"
"Annapolis Valley Regional School Board","Berwick","Anglophone","14141","1064","15.1","7,279","0.893","0.053"
"Cape Breton - Victoria Regional School Board","Sydney","Anglophone","14522","1293","12.5","6,937","0.877","0.040999999999999995"
"Chignecto-Central Regional School Board","Truro","Anglophone","21611","1651","14.3","11,057","0.87","0.07"
"Conseil scolaire acadien provincial","Dartmouth","Francophone","4771","389","11.6","4,771","0.8390000000000001","0.004"
"Halifax Regional School Board","Dartmouth","Anglophone","49651","3900","13.8","27,115","0.9009999999999999","0.05"
"South Shore Regional School Board","Bridgewater","Anglophone","7065","595","13.5","3,516","0.888","0.073"
"Strait Regional School Board","Port Hastings","Anglophone","6988","612","12.5","3,638","0.897","0.027000000000000003"
